{"contractStatus":"candidate","engineVersion":"oridesign-independent-face-complex-auditor/1.0.0-candidate","experimentId":"geometry.fold-face-complex-audit-v1","inputHash":"sha256:cfb60e4eb9f9800361d4e629660ff877aace6ec5b3cedc8b71cca87fcbe48a78","outcome":"completed","parameterHash":"sha256:3293f50892004c6052b3b78e5332c1ad20aa1631c3fe25baff8c2c2237bc2473","reasonCode":null,"recordType":"m0f-experiment-result","repetition":0,"result":{"auditOutcome":"consistent","contractStatus":"candidate","implementationRole":"independent-auditor","recordType":"m0f-face-complex-audit-result","schemaVersion":1,"scientificClaim":false,"scope":"face-complex-only","topology":{"boundedFaceCount":1,"createdIntersectionVertexCount":0,"eulerValue":1,"nonDyadicVertexCount":0,"planarEdgeCount":6,"planarVertexCount":6,"sourceEdgeCount":6,"sourceVertexCount":6,"triangleCount":4},"verificationIndependence":"separate-projective-kernel-not-full-reference-verifier"},"runnerVersion":"oridesign-m0f-experiment-runner/1.0.0-candidate","schemaId":"https://oridesign.local/schemas/m0f/experiment-result-v1.schema.json","schemaVersion":1,"scientificClaim":false,"seed":42,"semanticHash":"sha256:3f1cc26091919ee4c8b2d8a72b57b6001a08de4e3c1e39fb3615b8f75e89bf0e"}
