{"contractStatus":"candidate","engineVersion":"oridesign-fold-face-reconstruction/1.0.0-candidate","experimentId":"geometry.fold-face-reconstruction-v1","inputHash":"sha256:39107bf88397d36fe42cea09b05f754b6d669e9b4c7c1211427adbbbe0e2d2e2","outcome":"completed","parameterHash":"sha256:e9853837a24b92f6a9e8bf46d12de14fc01a651cee21c4c0a9e98368936a25a4","reasonCode":null,"recordType":"m0f-experiment-result","repetition":0,"result":{"contractStatus":"candidate","conventionsId":"oridesign-m0f-conventions-v1","edges":[{"assignment":"B","id":"e0","sourceEdges":[{"assignment":"B","id":"e:0","sourceEdgeIndex":5}],"vertexIds":["v0","v1"]},{"assignment":"B","id":"e1","sourceEdges":[{"assignment":"B","id":"e:1","sourceEdgeIndex":0}],"vertexIds":["v0","v4"]},{"assignment":"B","id":"e2","sourceEdges":[{"assignment":"B","id":"e:2","sourceEdgeIndex":4}],"vertexIds":["v1","v3"]},{"assignment":"B","id":"e3","sourceEdges":[{"assignment":"B","id":"e:3","sourceEdgeIndex":3}],"vertexIds":["v2","v3"]},{"assignment":"B","id":"e4","sourceEdges":[{"assignment":"B","id":"e:4","sourceEdgeIndex":2}],"vertexIds":["v2","v5"]},{"assignment":"B","id":"e5","sourceEdges":[{"assignment":"B","id":"e:5","sourceEdgeIndex":1}],"vertexIds":["v4","v5"]}],"exactCoordinateEncoding":"oridesign-exact-rational-json-v1","exteriorBoundary":{"areaSign":1,"edgeIds":["e1","e5","e4","e3","e2","e0"],"id":"candidate-exterior","vertexIds":["v0","v4","v5","v2","v3","v1"]},"faces":[{"areaSign":-1,"edgeIds":["e0","e2","e3","e4","e5","e1"],"id":"candidate-face:000001","triangles":[{"faceId":"candidate-face:000001","id":"30:candidate-rational-triangle-v1:21:candidate-face:000001:2:v0:2:v1:2:v3","semanticVertexIds":["v0","v1","v3"],"vertexIds":["v0","v1","v3"]},{"faceId":"candidate-face:000001","id":"30:candidate-rational-triangle-v1:21:candidate-face:000001:2:v0:2:v2:2:v3","semanticVertexIds":["v0","v2","v3"],"vertexIds":["v0","v3","v2"]},{"faceId":"candidate-face:000001","id":"30:candidate-rational-triangle-v1:21:candidate-face:000001:2:v0:2:v2:2:v4","semanticVertexIds":["v0","v2","v4"],"vertexIds":["v4","v0","v2"]},{"faceId":"candidate-face:000001","id":"30:candidate-rational-triangle-v1:21:candidate-face:000001:2:v2:2:v4:2:v5","semanticVertexIds":["v2","v4","v5"],"vertexIds":["v2","v5","v4"]}],"vertexIds":["v0","v1","v3","v2","v5","v4"]}],"foldProjection":{"_oridesign_m0f_candidate":{"contractStatus":"candidate","conventionsId":"oridesign-m0f-conventions-v1","edgeIds":["e0","e1","e2","e3","e4","e5"],"exactCoordinateEncoding":"oridesign-exact-rational-json-v1","exactVerticesCoords":[{"x":{"denominator":"1","numerator":"0"},"y":{"denominator":"1","numerator":"0"}},{"x":{"denominator":"1","numerator":"0"},"y":{"denominator":"1","numerator":"3"}},{"x":{"denominator":"1","numerator":"1"},"y":{"denominator":"1","numerator":"1"}},{"x":{"denominator":"1","numerator":"1"},"y":{"denominator":"1","numerator":"3"}},{"x":{"denominator":"1","numerator":"3"},"y":{"denominator":"1","numerator":"0"}},{"x":{"denominator":"1","numerator":"3"},"y":{"denominator":"1","numerator":"1"}}],"faceIds":["candidate-face:000001"],"schemaVersion":1,"scientificClaim":false,"sourceEdgeIdsByEdge":[["e:0"],["e:1"],["e:2"],["e:3"],["e:4"],["e:5"]],"trianglesVerticesByFace":[{"faceId":"candidate-face:000001","triangleIds":["30:candidate-rational-triangle-v1:21:candidate-face:000001:2:v0:2:v1:2:v3","30:candidate-rational-triangle-v1:21:candidate-face:000001:2:v0:2:v2:2:v3","30:candidate-rational-triangle-v1:21:candidate-face:000001:2:v0:2:v2:2:v4","30:candidate-rational-triangle-v1:21:candidate-face:000001:2:v2:2:v4:2:v5"],"trianglesVertices":[[0,1,3],[0,3,2],[4,0,2],[2,5,4]]}],"vertexIds":["v0","v1","v2","v3","v4","v5"]},"edges_assignment":["B","B","B","B","B","B"],"edges_vertices":[[0,1],[0,4],[1,3],[2,3],[2,5],[4,5]],"faces_vertices":[[0,1,3,2,5,4]],"file_creator":"OriDesign M0F candidate reference","file_spec":1.2,"frame_classes":["creasePattern"],"vertices_coords":[[0,0],[0,3],[1,1],[1,3],[3,0],[3,1]]},"implementationRole":"reference","inputSpecVersion":"1.2","limitations":["candidate-reference-o-n-squared","single-connected-disk-no-holes-or-bridges","no-vertex-merge-tolerance-applied","display-coordinates-are-not-topology-evidence","candidate-stable-ids-not-frozen-for-product"],"recordType":"m0f-fold-face-reconstruction","schemaId":"https://oridesign.local/schemas/m0f/fold-face-reconstruction-result-v1.schema.json","schemaVersion":1,"scientificClaim":false,"topology":{"boundedFaceCount":1,"createdIntersectionVertexCount":0,"eulerValue":1,"nonDyadicVertexCount":0,"planarEdgeCount":6,"planarVertexCount":6,"sourceEdgeCount":6,"sourceVertexCount":6,"triangleCount":4},"vertices":[{"displayCoordinate":[0,0],"exactCoordinate":{"x":{"denominator":"1","numerator":"0"},"y":{"denominator":"1","numerator":"0"}},"id":"v0","sourceVertexIndex":0},{"displayCoordinate":[0,3],"exactCoordinate":{"x":{"denominator":"1","numerator":"0"},"y":{"denominator":"1","numerator":"3"}},"id":"v1","sourceVertexIndex":5},{"displayCoordinate":[1,1],"exactCoordinate":{"x":{"denominator":"1","numerator":"1"},"y":{"denominator":"1","numerator":"1"}},"id":"v2","sourceVertexIndex":3},{"displayCoordinate":[1,3],"exactCoordinate":{"x":{"denominator":"1","numerator":"1"},"y":{"denominator":"1","numerator":"3"}},"id":"v3","sourceVertexIndex":4},{"displayCoordinate":[3,0],"exactCoordinate":{"x":{"denominator":"1","numerator":"3"},"y":{"denominator":"1","numerator":"0"}},"id":"v4","sourceVertexIndex":1},{"displayCoordinate":[3,1],"exactCoordinate":{"x":{"denominator":"1","numerator":"3"},"y":{"denominator":"1","numerator":"1"}},"id":"v5","sourceVertexIndex":2}]},"runnerVersion":"oridesign-m0f-experiment-runner/1.0.0-candidate","schemaId":"https://oridesign.local/schemas/m0f/experiment-result-v1.schema.json","schemaVersion":1,"scientificClaim":false,"seed":41,"semanticHash":"sha256:b97f1975c95ef7a34a0142056b3fc25d032bd111fc8a3a37e72078839e6cf8c5"}
